unique_id,Datum,Omschrijving,Debet,Credit,boekjaar,Boekstuknummer,Actuele status,Factuurdatum,Factuurbedrag,Factuurnr leverancier,Betalingskenmerk,Bankrekening,Opdracht/contract gegevens
jul-2020 - jun-2021_0,06-07-2020,SOS Herstel Hang- en sluitwerk + d 133021-1),"126,42",,jul-2020 - jun-2021,1,Geboekt - Betaald,06-07-2020,"€126,42",20003472,0000001220003472,NL42RABO0393531015,Hang- en sluitwerk + drangers | WTD (hout) - ingetrapt - Nazien/Herstellen WTD van hout is ingetrapt door 2 onbekende personen (er is een PV). Scharnieren en slot zijn stuk. Deur is daarnaast ook nog beschadigd.
jul-2020 - jun-2021_1,08-07-2020,WALEVELD Herstel Naamplaatjes (132917-1),"33,28",,jul-2020 - jun-2021,2,Geboekt - Betaald,08-07-2020,"€33,28",20-2096,00000003120-2096,NL92RABO0307802000,Naamplaatjes | Naamplaatje plaatsen
jul-2020 - jun-2021_2,10-07-2020,GELDEREN Herstel Hemelwaterafvoer en go (132832-1),"130,05",,jul-2020 - jun-2021,4,Geboekt - Betaald,10-07-2020,"€130,05",202086,0000000081202086,NL78RABO0344749940,"Hemelwaterafvoer en goten | Hwa, beugels, zitten los . Hwa beugels zitten los ter hoogte van Sumatrastraat 227 A."
jul-2020 - jun-2021_3,21-07-2020,RRS Herstel Hemelwaterafvoer en go (133298-2),"260,53",,jul-2020 - jun-2021,6,Geboekt - Betaald,21-07-2020,"€260,53",2032852,0000000012032852,NL93RABO0102353654,Hemelwaterafvoer en goten | Lekkage - HWA - Nazien/HErstellen Mevr geeft aan dat er lekkage is aan de regenpijp. Er zit een band om deze regenpijp en daar lekt het. Dat is op de eerste etage. Achterbalkon van de 1e verdieping die kan erbij. ( nr 485 is de bovenbuurman)
jul-2020 - jun-2021_4,23-07-2020,SIBERG Herstel Intercom / bellen (inc (133307-1),"116,27",,jul-2020 - jun-2021,7,Geboekt - Betaald,23-07-2020,"€116,27",8201532,0000000428201532,NL94INGB0004963467,Intercom / bellen (incl. elektrische deuropeners) | Intercom/Deuropener - Woning - Werkt niet/Nazien ATD kan niet geopend worden vanuit de woning.
jul-2020 - jun-2021_5,23-07-2020,GELDEREN Herstel Hang- en sluitwerk + d (133542-1),"130,05",,jul-2020 - jun-2021,9,Geboekt - Betaald,23-07-2020,"€130,05",202275,0000000081202275,NL78RABO0344749940,"Hang- en sluitwerk + drangers | Wtd, rot, herstellen. Graag de wtd herstellen. Bewoner heeft het over houtrot."
jul-2020 - jun-2021_6,23-07-2020,GELDERENHerstel Hemelwaterafvoer en go (133298-1),"123,39",,jul-2020 - jun-2021,8,Geboekt - Betaald,23-07-2020,"€123,39",202259,0000000081202259,NL78RABO0344749940,Hemelwaterafvoer en goten | Lekkage - HWA - Nazien/HErstellen Mevr geeft aan dat er lekkage is aan de regenpijp. Er zit een band om deze regenpijp en daar lekt het. Dat is op de eerste etage. Achterbalkon van de 1e verdieping die kan erbij. ( nr 485 is de bovenbuurman)
jul-2020 - jun-2021_7,24-07-2020,YSP Herstel Kozijnen / ramen / deu133017-1),"70,97",,jul-2020 - jun-2021,10,Geboekt - Betaald,24-07-2020,"€70,97",PF000004445,000048PF00000444,NL29INGB0004500201,Kozijnen / ramen / deuren | ATD (hout) - Nazien/Herstellen ATD van hout valt niet goed in het slot.
jul-2020 - jun-2021_8,31-07-2020,RRS Herstel Hemelwaterafvoer en go (133298-3),"247,25",,jul-2020 - jun-2021,12,Geboekt - Betaald,31-07-2020,"€247,25",2034451,-,NL93RABO0102353654,Hemelwaterafvoer en goten | Lekkage - HWA - Nazien/HErstellen Mevr geeft aan dat er lekkage is aan de regenpijp. Er zit een band om deze regenpijp en daar lekt het. Dat is op de eerste etage. Achterbalkon van de 1e verdieping die kan erbij. ( nr 485 is de bovenbuurman)
jul-2020 - jun-2021_9,06-08-2020,SIBERG Herstel Intercom / bellen (inc (133514-1),"114,61",,jul-2020 - jun-2021,15,Geboekt - Betaald,06-08-2020,"€114,61",8201652,0000000428201652,NL94INGB0004963467,Intercom / bellen (incl. elektrische deuropeners) | Intercom/Microfoon - Woning - Werkt niet/Nazien Spraakgedeelte en knop om deur te openen werkt niet.
jul-2020 - jun-2021_10,20-08-2020,GELDERENHerstel Hemelwaterafvoer en go (133607-1),"334,54",,jul-2020 - jun-2021,19,Geboekt - Betaald,20-08-2020,"€334,54",202510,0000000081202510,NL78RABO0344749940,Hemelwaterafvoer en goten | HWA - Nazien/herstellen Lekkage bij S bocht/Manchet.
jul-2020 - jun-2021_11,20-08-2020,GELDEREN Herstel Kozijnen / ramen / deu (133921-1),"130,05",,jul-2020 - jun-2021,20,Geboekt - Betaald,20-08-2020,"€130,05",202522,0000000081202522,NL78RABO0344749940,Kozijnen / ramen / deuren | Raam (hout) - Keuken - Nazien/Herstellen
jul-2020 - jun-2021_12,25-08-2020,KBK Sum 22-D lek kozijn 5-05-20 (129358-3),"178,93",,jul-2020 - jun-2021,21,Geboekt - Betaald,25-08-2020,"€178,93",202006186,0000077202006186,NL90INGB0680693572,Kozijnen / ramen / deuren | Op 01/05 melding van bewoner ontvangen dat de lekkage aan het raamkozijn nog steeds aanwezig is/ niet is opgelost. Gaarne nazien/ herstellen. Oorspronkelijke melding: HERHALING: lekkage nog steeds aanwezig/ probleem niet opgelost. Gaarne zsm oppakken/ herstellen. Raam(kozijn) - slaapkamer - lekt/ lekkage.
jul-2020 - jun-2021_13,25-08-2020,KBK Mol431 2 ramen schilderen 7-04-20 (129304-2),"237,07",,jul-2020 - jun-2021,22,Geboekt - Betaald,25-08-2020,"€237,07",202006190,0000077202006190,NL90INGB0680693572,"Kozijnen / ramen / deuren | Keukenraam, sluit niet goed. lekkage. Graag keukenraam herstellen. Er lekt nu water bij regen er door heen."
jul-2020 - jun-2021_14,28-08-2020,Siberg Mol 465 schemerschakel. 17-08-20 (134368-1),"47,42",,jul-2020 - jun-2021,23,Geboekt - Betaald,28-08-2020,"€47,42",8201817,0000000428201817,NL94INGB0004963467,Algemene verlichting | Verlichting - trappenhuis - aan
jul-2020 - jun-2021_15,28-08-2020,Gelderen dranger ATD 10-08-20 (134171-1),"92,64",,jul-2020 - jun-2021,24,Geboekt - Betaald,28-08-2020,"€92,64",202658,0000000081202658,NL78RABO0344749940,Hang- en sluitwerk + drangers | ATD - Dranger - Werkt niet goed/ afstellen
jul-2020 - jun-2021_16,06-09-2020,GELDERENHerstel Kozijnen / ramen / deu (134521-1),"168,07",,jul-2020 - jun-2021,25,Geboekt - Betaald,06-09-2020,"€168,07",202747,0000000081202747,NL78RABO0344749940,Kozijnen / ramen / deuren | Raamkozijn (hout) - Woning - Nazien/Herstellen
jul-2020 - jun-2021_17,10-09-2020,SIBERG Herstel Intercom / bellen (inc(134920-1),"150,98",,jul-2020 - jun-2021,28,Geboekt - Betaald,10-09-2020,"€150,98",8201933,0000000428201933,NL94INGB0004963467,"Intercom / bellen (incl. elektrische deuropeners) | De hoofdingang van het gebouw is kapot. Wanneer iemand de zoemer probeert te gebruiken om iemand het gebouw binnen te laten, gaat de deur niet open. Je moet fysiek naar beneden gaan naar de hoofdingang om iemand binnen te laten. Het scharnier om de deur langzaam te sluiten is ook kapot, wat betekent dat het elke keer dat iemand het gebouw binnenkomt hard knalt."
jul-2020 - jun-2021_18,10-09-2020,GELDEREN Herstel Hang- en sluitwerk + d 134679-1),"280,79",,jul-2020 - jun-2021,30,Geboekt - Betaald,10-09-2020,"€280,79",202827,0000000081202827,NL78RABO0344749940,"Hang- en sluitwerk + drangers | ATD - slot - stuk Slot van de ATDEUR werkt niet meer. Bewoners trappen de deur gewoon van buitenaf open zonder te sleutel te gebruiken waardoor deur niet meer goed in het slot valt. Deur blijft nu open staan, je kunt deze nu zo open duwen van buitenaf."
jul-2020 - jun-2021_19,10-09-2020,GELDEREN Herstel Kozijnen / ramen / deu (134728-1),"154,15",,jul-2020 - jun-2021,29,Geboekt - Betaald,10-09-2020,"€154,15",202831,0000000081202831,NL78RABO0344749940,Kozijnen / ramen / deuren | WTD (hout) - Woning - Klemt/nazien De woningtoegangsdeur klemt.
jul-2020 - jun-2021_20,15-09-2020,SIBERG Herstel Intercom / bellen (inc (135030-1),"183,61",,jul-2020 - jun-2021,33,Geboekt - Betaald,15-09-2020,"€183,61",8201962,0000000428201962,NL94INGB0004963467,Intercom / bellen (incl. elektrische deuropeners) | Intercom - Woning - Werkt niet/Nazien
jul-2020 - jun-2021_21,18-09-2020,GELDEREN Herstel Hang- en sluitwerk + d (134848-1),"284,24",,jul-2020 - jun-2021,34,Geboekt - Betaald,18-09-2020,"€284,24",202912,0000000081202912,NL78RABO0344749940,Hang- en sluitwerk + drangers | ATD (hout) - slot/ cilinder - nazien/ herstellen.
jul-2020 - jun-2021_22,24-09-2020,GELDEREN Herstel Waterleiding (134951-1),"92,64",,jul-2020 - jun-2021,36,Geboekt - Betaald,24-09-2020,"€92,64",203011,0000000081203011,NL78RABO0344749940,Waterleiding | Lekkage. Onbekend waar het vandaan komt
jul-2020 - jun-2021_23,30-09-2020,WALEVELDHerstel Kozijnen / ramen / deu (134406-1),"130,05",,jul-2020 - jun-2021,40,Geboekt - Betaald,30-09-2020,"€130,05",203084,0000000081203084,NL78RABO0344749940,"Kozijnen / ramen / deuren | Raamkozijn - hout - gat Raam aan balkon, zit een gat in het hout."
jul-2020 - jun-2021_24,30-09-2020,GELDEREN Herstel Kozijnen / ramen / deu (132291-1),"1.343,58",,jul-2020 - jun-2021,39,Geboekt - Betaald,30-09-2020,"€1.343,58",203081,0000000081203081,NL78RABO0344749940,"Kozijnen / ramen / deuren | Tuin deur brokkelt af! Is verrot van binnen, dus tocht door het huis. Zit nu een gat in de deur."
jul-2020 - jun-2021_25,30-09-2020,HRT Tid 90 herstel HWA 14-09-20 (135370-1),"402,93",,jul-2020 - jun-2021,41,Geboekt - Betaald,30-09-2020,"€402,93",72004096,0000005672004096,NL50RABO0126213518,Hemelwaterafvoer en goten | HWA:
jul-2020 - jun-2021_26,13-10-2020,Siberg Tid 90 Intercom/bel 14-09-20 (135369-1),"99,34",,jul-2020 - jun-2021,43,Geboekt - Betaald,13-10-2020,"€99,34",8202098,0000000428202098,NL94INGB0004963467,"Intercom / bellen (incl. elektrische deuropeners) | Intercom, bel, Bel doet het niet. (intercom)"
jul-2020 - jun-2021_27,16-10-2020,RRS Moluk493 rioollucht-toilet 05-10-20 (136217-1),"186,76",,jul-2020 - jun-2021,44,Geboekt - Betaald,16-10-2020,"€186,76",2045746,-,NL93RABO0102353654,Rioolinspectie | Rioollucht - toilet
jul-2020 - jun-2021_28,19-10-2020,Waleveld Tid116 naamplaatjes 29-09-20 (136000-1),"33,28",,jul-2020 - jun-2021,45,Geboekt - Betaald,19-10-2020,"€33,28",20-3241,00000003120-3241,NL92RABO0307802000,Naamplaatjes | naamplaatje plaatsen
jul-2020 - jun-2021_29,25-10-2020,GELDEREN Herstel Kozijnen / ramen / deu (136201-1),"195,97",,jul-2020 - jun-2021,46,Geboekt - Betaald,25-10-2020,"€195,97",203665,0000000081203665,NL78RABO0344749940,Kozijnen / ramen / deuren | Gevelplaat - houtrot -
jul-2020 - jun-2021_30,31-10-2020,RRS Herstel Rioolinspectie (137365-1),"122,56",,jul-2020 - jun-2021,50,Geboekt - Betaald,31-10-2020,"€122,56",2048543,-,NL93RABO0102353654,Rioolinspectie | Bon achteraf: Rook inspectie uitvoeren.
jul-2020 - jun-2021_31,09-11-2020,SOS Herstel Intercom / bellen (inc (137351-1),"126,42",,jul-2020 - jun-2021,51,Geboekt - Betaald,09-11-2020,"€126,42",20006513,0000001220006513,NL42RABO0393531015,Intercom / bellen (incl. elektrische deuropeners) | Intercom - deurbel ATD - nazien/herstellen
jul-2020 - jun-2021_32,13-11-2020,GELDEREN Herstel Hang- en sluitwerk + d (136607-1),"99,29",,jul-2020 - jun-2021,53,Geboekt - Betaald,13-11-2020,"€99,29",204186,0000000081204186,NL78RABO0344749940,Hang- en sluitwerk + drangers | ATD - deurklink - los/nazien
jul-2020 - jun-2021_33,18-11-2020,WALEVELD Herstel Naamplaatjes (137516-1),"33,28",,jul-2020 - jun-2021,54,Geboekt - Betaald,18-11-2020,"€33,28",20-3593,00000003120-3593,NL92RABO0307802000,Naamplaatjes | naamplaatje plaatsen
jul-2020 - jun-2021_34,30-11-2020,SIBERG Herstel Intercom / bellen (inc (137351-2),"77,16",,jul-2020 - jun-2021,56,Geboekt - Betaald,30-11-2020,"€77,16",8202631,0000000428202631,NL94INGB0004963467,Intercom / bellen (incl. elektrische deuropeners) | Intercom - deurbel ATD - nazien/herstellen
jul-2020 - jun-2021_35,08-12-2020,WALEVELD Herstel lekkage Sumatrapl 38-A (137859-1),"185,74",,jul-2020 - jun-2021,58,Geboekt - Betaald,08-12-2020,"€185,74",20-3836,00000003120-3836,NL92RABO0307802000,"Gevels | Plantenbak, lekkage naar bewoner toe."
jul-2020 - jun-2021_36,08-12-2020,SIBERG Herstel schakelaar en armaturen (137293-1),"308,78",,jul-2020 - jun-2021,59,Geboekt - Betaald,08-12-2020,"€308,78",8202761,0000000428202761,NL94INGB0004963467,Algemene verlichting | Algemene verlichting - Nazien/Herstellen
jul-2020 - jun-2021_37,09-12-2020,GELDEREN Herstel kozijn Tidorestr 90(136507-1),"347,36",,jul-2020 - jun-2021,60,Geboekt - Betaald,09-12-2020,"€347,36",204866,0000000081204866,NL78RABO0344749940,Kozijnen / ramen / deuren | Tuin kozijn verrot.
jul-2020 - jun-2021_38,14-12-2020,SIBERG Sum.plantsoen 38D Herst bel(138350-1),"266,49",,jul-2020 - jun-2021,62,Geboekt - Betaald,14-12-2020,"€266,49",8202848,0000000428202848,NL94INGB0004963467,Intercom / bellen (incl. elektrische deuropeners) | INtercom: defekt.
jul-2020 - jun-2021_39,17-12-2020,SKK TIDORESTR82 Herstel sl.kmr raam (138247-1),"168,41",,jul-2020 - jun-2021,64,Geboekt - Betaald,17-12-2020,"€168,41",VF2020-36827,000087VF2020-368,NL50RABO0326198903,Kozijnen overig (kunststof e.d.) | Schuifraam - kunststof - los
jul-2020 - jun-2021_40,30-12-2020,GELDEREN Tid.str88A/B Herstel ATD(138616-1),"52,97",,jul-2020 - jun-2021,67,Geboekt - Betaald,30-12-2020,"€52,97",205325,0000000081205325,NL78RABO0344749940,Hang- en sluitwerk + drangers | ATD - Berging -Sluit niet De ATD naar de bergingen sluit niet valt niet in het slot graag nazien en herstellen.
jul-2020 - jun-2021_41,30-12-2020,GELDEREN Tidorestr 88 Herstel ATD (138615-1),"52,97",,jul-2020 - jun-2021,66,Geboekt - Betaald,30-12-2020,"€52,97",205324,0000000081205324,NL78RABO0344749940,"Hang- en sluitwerk + drangers | ATD - Slot - Sluit niet De ATD (zowel voorzijde pand als bergingsgang) valt niet in het slot en het zou al de 4e keer dit jaar zijn dat dit gebeurd graag nazien en herstellen. Meneer wil aanwezig zijn bij het herstel, graag dus wel afspraak maken."
jul-2020 - jun-2021_42,05-01-2021,SIBERG Tidorestr 120 Kabeldozen vervang (138272-1),"347,86",,jul-2020 - jun-2021,70,Geboekt - Betaald,05-01-2021,"€347,86",8210030,0000000428210030,NL94INGB0004963467,Elektraleiding | graag lasdozen en bedrading nalopen op nieuwe dak sumatraplantsoen. lijken niet goed afgemonteerd en gevoelig voor kortsluiting. foto's willen niet uploaden zijn bekend bij beheer.
jul-2020 - jun-2021_43,07-01-2021,DELTA Molukstr489 Nazien Lekkage slaapk (137294-1),"123,43",,jul-2020 - jun-2021,71,Geboekt - Betaald,07-01-2021,"€123,43",2100072,0000000552100072,NL17RABO0324668449,Waterleiding | Lekkage - Slaapkamer - Nazien/Herstellen
jul-2020 - jun-2021_44,12-01-2021,SIBERG Moluk.str481 Bel vervangen(138829-1),"77,16",,jul-2020 - jun-2021,75,Geboekt - Betaald,12-01-2021,"€77,16",8210125,0000000428210125,NL94INGB0004963467,Intercom / bellen (incl. elektrische deuropeners) | Deurbel defekt
jul-2020 - jun-2021_45,12-01-2021,RRS Moluk.str417 Rioolinspectie (139111-1),"236,87",,jul-2020 - jun-2021,74,Geboekt - Betaald,12-01-2021,"€236,87",2102545,-,NL93RABO0102353654,Rioolontstopping | lekkage - oorzaak onbekend
jul-2020 - jun-2021_46,13-01-2021,WALEVELD Herstel Naamplaatjes(138813-1),"33,28",,jul-2020 - jun-2021,76,Geboekt - Betaald,13-01-2021,"€33,28",21-0092,00000003121-0092,NL92RABO0307802000,Naamplaatjes | Naamplaatje plaatsen
jul-2020 - jun-2021_47,18-01-2021,SIBERG Zekering vervangen(139120-1),"35,40",,jul-2020 - jun-2021,78,Geboekt - Betaald,18-01-2021,"€35,40",8210201,0000000428210201,NL94INGB0004963467,Algemene verlichting | Verlichting defekt
jul-2020 - jun-2021_48,21-01-2021,YSP Molust 531 2 X atd sleutel (140043-1),"30,00",,jul-2020 - jun-2021,80,Geboekt - Betaald,21-01-2021,"€30,00",PF000005397,000048PF00000539,NL29INGB0004500201,Sleutelsymere | Sleutels - ATD - bijbestellen
jul-2020 - jun-2021_49,27-01-2021,GELDEREN Herstel ATD(139104-1),"234,12",,jul-2020 - jun-2021,82,Geboekt - Betaald,27-01-2021,"€234,12",210205,0000000081210205,NL78RABO0344749940,"Hang- en sluitwerk + drangers | ATD - dagschoot - stuk Dagschoot van de ATD is stuk, houdt de deur niet dicht."
jul-2020 - jun-2021_50,28-01-2021,GELDEREN Tidore70 Herstel slot ATD (139336-1),"254,99",,jul-2020 - jun-2021,83,Geboekt - Betaald,28-01-2021,"€254,99",210229,0000000081210229,NL78RABO0344749940,Hang- en sluitwerk + drangers | ATD - slot -stuk Slot ATD lijkt geforceerd. Is niet bruikbaar nu. ATD staat open.
jul-2020 - jun-2021_51,28-01-2021,GELDEREN Tidorestr76 Herstel WTD (130093-1),"1.336,54",,jul-2020 - jun-2021,84,Geboekt - Betaald,28-01-2021,"€1.336,54",210245,0000000081210245,NL78RABO0344749940,Hang- en sluitwerk + drangers | WTD - hout - klemt De WTD klemt.
jul-2020 - jun-2021_52,29-01-2021,GELDEREN Sumatr22-A Herstel ATD (139561-1),"361,33",,jul-2020 - jun-2021,85,Geboekt - Betaald,29-01-2021,"€361,33",210269,0000000081210269,NL78RABO0344749940,Kozijnen / ramen / deuren | ATD nazien en herstellen
jul-2020 - jun-2021_53,03-02-2021,GELD-Herstel Hang- en sluitwerk(139795-1),"99,29",,jul-2020 - jun-2021,86,Geboekt - Betaald,03-02-2021,"€99,29",210426,0000000081210426,NL78RABO0344749940,"Hang- en sluitwerk + drangers | ATD , hout, valt niet in het slot."
jul-2020 - jun-2021_54,04-02-2021,GELDEREN Suma30-C Herstel raam (139887-1),"163,38",,jul-2020 - jun-2021,87,Geboekt - Betaald,04-02-2021,"€163,38",210468,0000000081210468,NL78RABO0344749940,Kozijnen / ramen / deuren | Kozijn - Hout - Lekt
jul-2020 - jun-2021_55,12-02-2021,SIBERG Herstel armatuur (139013-1),"259,78",,jul-2020 - jun-2021,90,Geboekt - Betaald,12-02-2021,"€259,78",8210529,0000000428210529,NL94INGB0004963467,Algemene verlichting | Verlichting - trappenhuis - 1e verdieping - defect
jul-2020 - jun-2021_56,15-02-2021,WALEVELD Molukstr445 naamplaatje (140320-1),"33,28",,jul-2020 - jun-2021,91,Geboekt - Betaald,15-02-2021,"€33,28",21-0510,00000003121-0510,NL92RABO0307802000,Naamplaatjes | naamplaatje plaatsen
jul-2020 - jun-2021_57,15-02-2021,WALEVELD Moluk519 naamplaatje (140583-1),"33,28",,jul-2020 - jun-2021,92,Geboekt - Betaald,15-02-2021,"€33,28",21-0521,00000003121-0521,NL92RABO0307802000,Naamplaatjes | naamplaatje plaatsen
jul-2020 - jun-2021_58,23-02-2021,SOS MOLUK501 Herstel CVZ storing (140792-1),"131,87",,jul-2020 - jun-2021,95,Geboekt - Betaald,23-02-2021,"€131,87",21000979,0000001221000979,NL42RABO0393531015,Algemene verlichting | Stroomuitval - alg.ruimte -
jul-2020 - jun-2021_59,23-02-2021,SOS Herstel CVZ storing(140888-1),"131,87",,jul-2020 - jun-2021,96,Geboekt - Betaald,23-02-2021,"€131,87",21000983,0000001221000983,NL42RABO0393531015,Algemene verlichting | Verlichting - stroomuitval
jul-2020 - jun-2021_60,26-02-2021,GELDEREN Moluk515 Herstel deur balkon (140577-1),"253,08",,jul-2020 - jun-2021,101,Geboekt - Betaald,26-02-2021,"€253,08",210925,0000000081210925,NL78RABO0344749940,Kozijnen / ramen / deuren | Deur - balkon - klemt
jul-2020 - jun-2021_61,26-02-2021,GELDEREN Tidire88 Herstel ATD (141068-1),"440,46",,jul-2020 - jun-2021,103,Geboekt - Betaald,26-02-2021,"€440,46",210941,0000000081210941,NL78RABO0344749940,Kozijnen / ramen / deuren | ATD - Slot - Sluit niet
jul-2020 - jun-2021_62,26-02-2021,GELDREN Tidore88A/B Herstel ATD (141067-1),"466,72",,jul-2020 - jun-2021,104,Geboekt - Betaald,26-02-2021,"€466,72",210940,0000000081210940,NL78RABO0344749940,Kozijnen / ramen / deuren | ATD - Berging -Sluit niet
jul-2020 - jun-2021_63,26-02-2021,RRS Herstel Rioolontstopping56408-1),"250,62",,jul-2020 - jun-2021,105,Geboekt - Betaald,26-02-2021,"€250,62",2111827,0000000012111827,NL93RABO0102353654,Rioolontstopping | Preventief reinigen van de afvoerleiding conform offerte 20.14.353 d.d. 25 augustus 2014. 1malige opdracht voor reinigen per direct en in december 2014.
jul-2020 - jun-2021_64,26-02-2021,GELDEREN Moluk417 Nazien lekkage(140890-1),"92,64",,jul-2020 - jun-2021,102,Geboekt - Betaald,26-02-2021,"€92,64",210933,0000000081210933,NL78RABO0344749940,"Wanden / plafonds / vloeren | Lekkage - bovenburen Lekkage naar woning 417, afkomstig van bovenburen op 421 of 423. Zie bijgevoegde foto's."
jul-2020 - jun-2021_65,26-02-2021,SIBERG Molukstr519 Herstel intercom (139661-1),"67,59",,jul-2020 - jun-2021,100,Geboekt - Betaald,26-02-2021,"€67,59",8210670,0000000428210670,NL94INGB0004963467,Intercom / bellen (incl. elektrische deuropeners) | Intercom; defekt. Er is een harde piep in de hoorn te horen
jul-2020 - jun-2021_66,02-03-2021,YSP Nazien cilinder (141717-1),"45,23",,jul-2020 - jun-2021,107,Geboekt - Betaald,02-03-2021,"€45,23",PF000005682,000048PF00000568,NL29INGB0004500201,Sleutelsymere | Sleutels - Nazien/Herstellen N.a.v. mailverkeer met Patrick een opdracht voor het nakijken en zo nodig bestellen van een nieuwe cilinder mocht deze stuk zijn.
jul-2020 - jun-2021_67,04-03-2021,SIBERG Molukken541 Herstel bel (141017-1),"227,01",,jul-2020 - jun-2021,108,Geboekt - Betaald,04-03-2021,"€227,01",8210721,0000000428210721,NL94INGB0004963467,Intercom / bellen (incl. elektrische deuropeners) | de bel buiten mijn appartement doet het niet (meer)
jul-2020 - jun-2021_68,08-03-2021,WALEVELD Sumatra217A Naamplaatje (141911-1),"33,28",,jul-2020 - jun-2021,111,Geboekt - Betaald,08-03-2021,"€33,28",21-0805,00000003121-0805,NL92RABO0307802000,Naamplaatjes | naamplaatje plaatsen
jul-2020 - jun-2021_69,08-03-2021,WALEVELD Sumatrstr229D naamplaatje (141365-1),"33,28",,jul-2020 - jun-2021,110,Geboekt - Betaald,08-03-2021,"€33,28",21-0806,00000003121-0806,NL92RABO0307802000,Naamplaatjes | naamplaatje plaatsen
jul-2020 - jun-2021_70,11-03-2021,GELDEREN Molukstr465 Herstel WTD (141767-1),"92,64",,jul-2020 - jun-2021,116,Geboekt - Betaald,11-03-2021,"€92,64",211153,0000000081211153,NL78RABO0344749940,Kozijnen / ramen / deuren | WTD - Hout - Sluit niet goed
jul-2020 - jun-2021_71,12-03-2021,SIBERG Molukstr467 Herst. schakelaar (141722-1),"67,59",,jul-2020 - jun-2021,118,Geboekt - Betaald,12-03-2021,"€67,59",8210825,0000000428210825,NL94INGB0004963467,Algemene verlichting | Tijdschakelaar - Verlichting - Herstellen.
jul-2020 - jun-2021_72,12-03-2021,GELDEREN Molukstr459 herstel balkondeur(141530-1),"189,70",,jul-2020 - jun-2021,117,Geboekt - Betaald,12-03-2021,"€189,70",211221,0000000081211221,NL78RABO0344749940,Hang- en sluitwerk + drangers | Balkondeur - hout - slot
jul-2020 - jun-2021_73,19-03-2021,GELDEREN Molukstr489 herstel lekkage (141648-1),"184,91",,jul-2020 - jun-2021,123,Geboekt - Betaald,19-03-2021,"€184,91",211393,0000000081211393,NL78RABO0344749940,Waterleiding | Lekkage - portiek 489 - oorzaak onbekend
jul-2020 - jun-2021_74,19-03-2021,GELDEREN Sumatra221D Herstel schacht (142133-1),"154,15",,jul-2020 - jun-2021,124,Geboekt - Betaald,19-03-2021,"€154,15",211413,0000000081211413,NL78RABO0344749940,Waterleiding | Lekkage - ventilatieschacht/ontluchtingskanaal - trappenhuis
jul-2020 - jun-2021_75,23-03-2021,WALEVELD Nazien lekkage(140890-2),"136,45",,jul-2020 - jun-2021,126,Geboekt - Betaald,23-03-2021,"€136,45",21-0928,00000003121-0928,NL92RABO0307802000,"Gevels | Lekkage - bovenburen Lekkage naar woning 417, afkomstig van bovenburen op 421 of 423. Zie bijgevoegde foto's."
jul-2020 - jun-2021_76,02-04-2021,SIBER-kosten verv zekering(142545-1),"86,59",,jul-2020 - jun-2021,131,Geboekt - Betaald,02-04-2021,"€86,59",8211043,0000000428211043,NL94INGB0004963467,"Algemene verlichting | Verlichting; trappenhal, defekt."
jul-2020 - jun-2021_77,06-04-2021,SIBER-Herstel Intercom / bellen (142628-1),"85,06",,jul-2020 - jun-2021,132,Geboekt - Betaald,06-04-2021,"€85,06",8211068,0000000428211068,NL94INGB0004963467,Intercom / bellen (incl. elektrische deuropeners) | Intercom - deuropener - werkt niet
jul-2020 - jun-2021_78,20-04-2021,GELDEREN - Credit op IF:21136,"-160,81",,jul-2020 - jun-2021,135,Geboekt - Betaald,20-04-2021,"-€160,81",211935,-,NL78RABO0344749940,-
jul-2020 - jun-2021_79,23-04-2021,KBK Sumatrapl.22D Herstel raam (129358-4),"203,81",,jul-2020 - jun-2021,136,Geboekt - Betaald,23-04-2021,"€203,81",202104866,0000077202104866,NL90INGB0680693572,Kozijnen / ramen / deuren | Op 01/05 melding van bewoner ontvangen dat de lekkage aan het raamkozijn nog steeds aanwezig is/ niet is opgelost. Gaarne nazien/ herstellen. Oorspronkelijke melding: HERHALING: lekkage nog steeds aanwezig/ probleem niet opgelost. Gaarne zsm oppakken/ herstellen. Raam(kozijn) - slaapkamer - lekt/ lekkage.
jul-2020 - jun-2021_80,23-04-2021,SOS Molukkenstr449 Herstel slot ATD (143314-1),"103,78",,jul-2020 - jun-2021,137,Geboekt - Betaald,23-04-2021,"€103,78",21002550,0000001221002550,NL42RABO0393531015,Hang- en sluitwerk + drangers | ATD - Slot - Opent niet
jul-2020 - jun-2021_81,30-04-2021,RRS Molukstr449 Herstel Rioolinspectie (140416-1),"285,23",,jul-2020 - jun-2021,140,Geboekt - Betaald,30-04-2021,"€285,23",2122562,-,NL93RABO0102353654,Rioolinspectie | Graag werkbon met nummer 4629850; Het betreft reinigen standleiding.
jul-2020 - jun-2021_82,04-05-2021,GELDEREN MOLUK.STR531 Herstel slot berg (143285-1),"156,31",,jul-2020 - jun-2021,139,Geboekt - Betaald,04-05-2021,"€156,31",212221,0000000081212221,NL78RABO0344749940,Hang- en sluitwerk + drangers | berging deur - slot - herstellen
jul-2020 - jun-2021_83,20-05-2021,vGelderen Sum22-a dranger ATD 10-05-21 (144087-1),"130,05",,jul-2020 - jun-2021,144,Geboekt - Betaald,20-05-2021,"€130,05",212535,0000000081212535,NL78RABO0344749940,Hang- en sluitwerk + drangers | De hoofdingang van het gebouw is weer kapot. Het sluit niet langzaam en klapt gewoon dicht. Het is erg luidruchtig en je kunt het elke keer vanuit ons appartement horen klappen.
jul-2020 - jun-2021_84,20-05-2021,vGelderen Molukk493 slot ATD 11-05-21 (144131-1),"94,79",,jul-2020 - jun-2021,145,Geboekt - Betaald,20-05-2021,"€94,79",212537,0000000081212537,NL78RABO0344749940,Hang- en sluitwerk + drangers | ATD - Slot - Sluit niet
jul-2020 - jun-2021_85,28-05-2021,Gelderen Mol465 hwa verstopt 17-05-21 (144253-1),"92,64",,jul-2020 - jun-2021,147,Geboekt - Betaald,28-05-2021,"€92,64",212681,0000000081212681,NL78RABO0344749940,Hemelwaterafvoer en goten | Regenpijp - Verstopt - Tuin
